{
  "schema_ok": true,
  "missing_rate_by_field": {
    "id": 0.0,
    "label": 0.0,
    "content": 0.5
  },
  "duplicates_rate": 0.0,
  "range_violations_count_by_field": {
    "score": 0
  },
  "enum_violations_count_by_field": {
    "status": 0
  },
  "postcheck_ok": true,
  "patterns_remaining_count": 0
}